{
  "$ref": "#/definitions/team",
  "definitions": {
    "team": {
      "type": "object",
      "properties": {
        "name": {
          "type": "string"
        },
        "role": {
          "type": "string"
        },
        "qualifications": {
          "type": "string"
        },
        "bio": {
          "type": "string"
        },
        "image": {
          "type": "string"
        },
        "order": {
          "type": "number",
          "default": 0
        },
        "$schema": {
          "type": "string"
        }
      },
      "required": [
        "name",
        "role",
        "qualifications",
        "bio"
      ],
      "additionalProperties": false
    }
  },
  "$schema": "http://json-schema.org/draft-07/schema#"
}