{
  "name": "Dr Zuben Mohanty",
  "role": "Oral & Maxillofacial Surgeon",
  "qualifications": "M.D.S. in Oral & Maxillofacial Surgery",
  "bio": "I take great pleasure in providing top-quality care for my patients, developing strong relationships with them, and accommodating their unique needs. From comprehensive family appointments to clear communication of treatment options, I am dedicated to achieving the best outcomes for my patients.",
  "order": 1
}
